Category,Product Name,Product Price,product URL,Product Features,Ratings,Total Reviews
Mobile,"POWERADD [Upgraded] Pilot X7 20000mAh Portable Charger, Dual 3.1A Output External Power Bank with LED Flashlight, Compatible with iPhone, iPad, Samsung Galaxy and More - Black Red",$24.99,https://www.amazon.com//gp/slredirect/picassoRedirect.html/ref=pa_sp_atf_aps_sr_pg1_1?ie=UTF8&adId=A08546941XQ55FU1JVP5R&url=%2FPOWERADD-Pilot-X7-Flashlight-Compatible%2Fdp%2FB0157RHV8O%2Fref%3Dsr_1_1_sspa%3Fdchild%3D1%26keywords%3DPOWERADD%2Bpower%2Bbank%26qid%3D1619354061%26sr%3D8-1-spons%26psc%3D1%26smid%3DA2UX2NOV6U33XD&qualifier=1619354061&id=1250397627598782&widgetName=sp_atf,"{'Product Dimensions': '5.98 x 3.15 x 0.79 inches', 'Item Weight': '15.2 ounces', 'ASIN': 'B0157RHV8O', 'Item model number': 'Pilot X7', 'Batteries': '2 Lithium Polymer batteries required. (included)', 'Customer Reviews': '4.6 out of 5 stars\n\n\n\n\n\n\n\n\n8,955 ratings\n\n\n\n\n\n\n4.6 out of 5 stars', 'Best Sellers Rank': '#6,720 in Cell Phones & Accessories (See Top 100 in Cell Phones & Accessories)\n\n#172 in Cell Phone Portable Power Banks\n\n#180 in Cell Phone Replacement Batteries', 'Is Discontinued By Manufacturer': 'No', 'Other display features': 'Wireless', 'Colour': 'Black+Red', 'Included Components': 'Package Content: 1 X POWERADD X7 Portable Charger 1 X Micro USB Cable (MFi 8-Pin Cable is NOT INCLUDED) 1 X User Manual PS: Please note, the power indicator may be vary, it will not affect the function', 'Manufacturer': 'POWERADD JiangXi Beston Electronic Science and Technology Co.,Ltd', 'Date First Available': 'December 4, 2017'}",4.6 out of 5 stars,8955
Mobile,"POWERADD Pilot 4GS 12000mAh Portable Charger 8 Pin Input Power Bank with 3A High-Speed Output Compatible with iPhone, iPad, iPod, Samsung and More - Silver (8 Pin Cable Include)",$21.99,https://www.amazon.com//Poweradd-Pilot-4GS-12000mAh-High-Speed/dp/B01LC1YO8Y/ref=sr_1_3?dchild=1&keywords=POWERADD+power+bank&qid=1619354061&sr=8-3,"{'Color': 'Silver', 'Brand': 'POWERADD', 'Connector Type': 'Usb, Lightning', 'Battery Capacity': '12000 Milliamp Hours', 'Item Dimensions LxWxH': '5.43 x 0.54 x 2.91 inches', 'Battery Cell Composition': 'Lithium Polymer', 'Item Weight': '8.4 ounces', 'Number of Ports': '2', 'Product Dimensions': '5.43 x 0.54 x 2.91 inches', 'ASIN': 'B01LC1YO8Y', 'Item model number': 'Pilot 4GS Silver', 'Batteries': '2 Product Specific batteries required.', 'Customer Reviews': '4.6 out of 5 stars\n\n\n\n\n\n\n\n\n13,735 ratings\n\n\n\n\n\n\n4.6 out of 5 stars', 'Best Sellers Rank': '#175 in Cell Phones & Accessories (See Top 100 in Cell Phones & Accessories)\n\n#8 in Cell Phone Replacement Batteries\n\n#8 in Cell Phone Portable Power Banks', 'Is Discontinued By Manufacturer': 'No', 'Other display features': 'Wireless', 'Colour': 'Silver', 'Manufacturer': 'Poweradd', 'Date First Available': 'September 1, 2016'}",4.6 out of 5 stars,13735
Mobile,"POWERADD EnergyCell 5000 Portable Charger, The Lightest 5000mAh Slim Power Bank with 2.4A Output, Compatible with iPhone Samsung and More (Black)",$11.97,https://www.amazon.com//POWERADD-EnergyCell-Portable-Lightest-Compatible/dp/B07MBF4ZLN/ref=sr_1_5?dchild=1&keywords=POWERADD+power+bank&qid=1619354061&sr=8-5,"{'Color': 'Black', 'Brand': 'POWERADD', 'Connector Type': 'Micro USB', 'Battery Capacity': '5000 Milliamp Hours', 'Item Dimensions LxWxH': '4.3 x 1.1 x 1.1 inches', 'Battery Cell Composition': 'Lithium Ion', 'Item Weight': '3.52 ounces', 'Charging Time': '1.5 Hours', 'Product Dimensions': '4.3 x 1.1 x 1.1 inches', 'ASIN': 'B07MBF4ZLN', 'Batteries': '1 Lithium ion batteries required. (included)', 'Customer Reviews': '4.5 out of 5 stars\n\n\n\n\n\n\n\n\n1,891 ratings\n\n\n\n\n\n\n4.5 out of 5 stars', 'Best Sellers Rank': '#3,322 in Cell Phones & Accessories (See Top 100 in Cell Phones & Accessories)\n\n#94 in Cell Phone Portable Power Banks\n\n#96 in Cell Phone Replacement Batteries', 'Is Discontinued By Manufacturer': 'No', 'Other display features': 'Wireless', 'Colour': 'Black', 'Manufacturer': 'POWERADD', 'Date First Available': 'March 6, 2019'}",4.5 out of 5 stars,1891
Mobile,"POWERADD EnergyCell AC 5000, Portable Charger 5000mAh with Dual USB Wall Charger, Foldable Plug, Battery Pack for iPhone, iPad, Android, Samsung Galaxy and More（Black）",$19.99,https://www.amazon.com//POWERADD-EnergyCell-Portable-Foldable-More%EF%BC%88Black%EF%BC%89/dp/B07S1QPCLH/ref=sr_1_6?dchild=1&keywords=POWERADD+power+bank&qid=1619354061&sr=8-6,"{'Brand': 'POWERADD', 'Connector Type': 'Usb, Micro usb', 'Battery Capacity': '5000 Milliamp Hours', 'Item Dimensions LxWxH': '3.02 x 2.76 x 1.18 inches', 'Battery Cell Composition': 'Lithium Ion', 'Number of Ports': '2', 'Product Dimensions': '3.02 x 2.76 x 1.18 inches', 'Item Weight': '7.4 ounces', 'ASIN': 'B07S1QPCLH', 'Item model number': 'LN013-5000', 'Customer Reviews': '4.6 out of 5 stars\n\n\n\n\n\n\n\n\n570 ratings\n\n\n\n\n\n\n4.6 out of 5 stars', 'Best Sellers Rank': '#22,451 in Cell Phones & Accessories (See Top 100 in Cell Phones & Accessories)\n\n#421 in Cell Phone Portable Power Banks\n\n#572 in Cell Phone Replacement Batteries', 'Other display features': 'Wireless', 'Manufacturer': 'POWERADD', 'Date First Available': 'May 19, 2019'}",4.6 out of 5 stars,570
Mobile,"POWERADD Power Strip Surge Protector 6 Outlets & 6 USB Charging Ports, 6ft Heavy Duty Extension Cord, USB Outlet Extender for Home & Office 1625W/13A",$22.99,https://www.amazon.com//gp/slredirect/picassoRedirect.html/ref=pa_sp_mtf_aps_sr_pg1_1?ie=UTF8&adId=A00873783KCO4JTF0D8B7&url=%2FPoweradd-Protector-Outlets-Charging-Extension%2Fdp%2FB018S7VEVA%2Fref%3Dsr_1_7_sspa%3Fdchild%3D1%26keywords%3DPOWERADD%2Bpower%2Bbank%26qid%3D1619354061%26sr%3D8-7-spons%26psc%3D1%26smid%3DA2UX2NOV6U33XD&qualifier=1619354061&id=1250397627598782&widgetName=sp_mtf,"{'Brand': 'POWERADD', 'Color': 'White', 'Maximum Surge Rating': '900 Joules', 'Item Weight': '1.1 pounds', 'Item Dimensions LxWxH': '8.58 x 3.1 x 1.1 inches', 'Number of Ports': '6', 'Total Power Outlets': '6', 'Amperage': '13 Amps', 'Product Dimensions': '8.58 x 3.1 x 1.1 inches', 'ASIN': 'B018S7VEVA', 'Item model number': 'FBA_PS-9008WE', 'Customer Reviews': '4.8 out of 5 stars\n\n\n\n\n\n\n\n\n3,758 ratings\n\n\n\n\n\n\n4.8 out of 5 stars', 'Best Sellers Rank': '#753 in Electronics (See Top 100 in Electronics)\n\n#65 in Electrical Cords, Adapters & Multi-Outlets\n\n#73 in Power Strips', 'Is Discontinued By Manufacturer': 'No', 'Date First Available': 'December 1, 2015', 'Manufacturer': 'Poweradd'}",4.8 out of 5 stars,3758
Mobile,"POWERADD 2ND Gen Pilot 2GS 10000mAh Power Bank, Dual USB Port Portable Charger 3.4A High-Speed Charge for iPhone, Samsung Galaxy, Other Smartphone and Tablet - Black (Apple Cable Not Included)",$17.99,https://www.amazon.com//POWERADD-Pilot-2GS-High-Speed-Smartphone/dp/B00N2JBTEM/ref=sr_1_8?dchild=1&keywords=POWERADD+power+bank&qid=1619354061&sr=8-8,"{'Color': 'Black', 'Brand': 'POWERADD', 'Connector Type': 'Usb', 'Voltage': '5 Volts', 'Battery Capacity': '10000 Milliamp Hours', 'Item Dimensions LxWxH': '5.67 x 2.87 x 0.59 inches', 'Item Weight': '9.1 ounces', 'Number of Ports': '2', 'Product Dimensions': '5.67 x 2.87 x 0.59 inches', 'ASIN': 'B00N2JBTEM', 'Item model number': 'MP-1310BK2-UK', 'Batteries': '1 Lithium Polymer batteries required.', 'Customer Reviews': '4.5 out of 5 stars\n\n\n\n\n\n\n\n\n8,493 ratings\n\n\n\n\n\n\n4.5 out of 5 stars', 'Best Sellers Rank': '#5,305 in Cell Phones & Accessories (See Top 100 in Cell Phones & Accessories)\n\n#141 in Cell Phone Portable Power Banks\n\n#145 in Cell Phone Replacement Batteries', 'Is Discontinued By Manufacturer': 'No', 'Other display features': 'Wireless', 'Colour': 'Black', 'Included Components': '1 X POWERADD Portable Charger 1 X Micro USB Cable ( MFi 8-Pin Cable is NOT INCLUDED) 1 X User Manual', 'Manufacturer': 'SHENZHEN FIRSTAR BATTERY CO.LTD', 'Date First Available': 'August 27, 2014'}",4.5 out of 5 stars,8493
Mobile,"Elepower 2 in 1 Car and Wall Charger Portable Dual USB Ports 2.1A in Total Travel Wall iPhone Charger for iPhone 11 / XS X /8 7 Plus, Samsung Galaxy, Google, Power Bank and More - Black",$12.99,https://www.amazon.com//gp/slredirect/picassoRedirect.html/ref=pa_sp_mtf_aps_sr_pg2_1?ie=UTF8&adId=A0372322270AWHH7OLK14&url=%2FElepower-Charger-Travel-Samsung-More-Black%2Fdp%2FB01CZW3D3Q%2Fref%3Dsr_1_28_sspa%3Fdchild%3D1%26keywords%3DPOWERADD%2Bpower%2Bbank%26qid%3D1619354129%26sr%3D8-28-spons%26psc%3D1&qualifier=1619354129&id=4296891260501890&widgetName=sp_mtf,"{'Compatible Devices': 'Samsung Galaxy S6 Edge, Samsung Galaxy S6, Samsung Galaxy S5, Samsung Galaxy Note 4, Apple iPhone 4, Samsung Galaxy S4, Samsung Galaxy S3Samsung Galaxy S6 Edge, Samsung Galaxy S6, Samsung Galaxy S5, Sa…\n\nSee more', 'Brand': 'Elepower', 'Color': '01 Black', 'Item Weight': '2.88 ounces', 'Current Rating': '2.1 Amps', 'Input Voltage': '240 Volts', 'Total USB Ports': '2', 'Product Dimensions': '2.6 x 2.6 x 1.3 inches', 'ASIN': 'B01CZW3D3Q', 'Item model number': '4326186143', 'Customer Reviews': '4.6 out of 5 stars\n\n\n\n\n\n\n\n\n259 ratings\n\n\n\n\n\n\n4.6 out of 5 stars', 'Best Sellers Rank': '#20,911 in Cell Phones & Accessories (See Top 100 in Cell Phones & Accessories)\n\n#420 in Cell Phone Automobile Chargers', 'Is Discontinued By Manufacturer': 'No', 'Special Features': 'Dual USB Port, Build with Smart IC Technology, Foldable Plug, Wall and Car Charger all in one', 'Other display features': 'Wireless', 'Colour': '01 Black', 'Manufacturer': 'Elepower', 'Date First Available': 'March 15, 2016'}",4.6 out of 5 stars,259
Mobile,"POWERADD Pilot Pro4 25600mAh Laptop Portable Charger, AC Output 110V/60W QC 3.0 Port 5V 9V 12V USB-A High Capacity External Battery for MacBook/Dell XPS/Pocket PC/iPod/iPad/Smartphone and More",$83.99,https://www.amazon.com//POWERADD-25600mAh-Portable-Capacity-Smartphone/dp/B07MDZVM6M/ref=sr_1_30?dchild=1&keywords=POWERADD+power+bank&qid=1619354129&sr=8-30,"{'Brand': 'POWERADD', 'Connector Type': 'Usb, Usb type a', 'Item Dimensions LxWxH': '7.48 x 5.2 x 1.97 inches', 'Battery Cell Composition': 'Lithium Ion', 'Number of Ports': '3', 'Product Dimensions': '7.48 x 5.2 x 1.97 inches', 'Item Weight': '2.77 pounds', 'ASIN': 'B07MDZVM6M', 'Customer Reviews': '2.9 out of 5 stars\n\n\n\n\n\n\n\n\n7 ratings\n\n\n\n\n\n\n2.9 out of 5 stars', 'Best Sellers Rank': '#166,964 in Cell Phones & Accessories (See Top 100 in Cell Phones & Accessories)\n\n#3,709 in Cell Phone Replacement Batteries', 'Is Discontinued By Manufacturer': 'No', 'Other display features': 'Wireless', 'Manufacturer': 'POWERADD', 'Date First Available': 'January 2, 2019'}",2.9 out of 5 stars,7
Mobile,Anleo Hard EVA Travel Case for POWERADD Pilot 4GS 12000mAh / Uni-Yeap 11000mAh External Battery Charger Power Bank Color: Rose Gold,$9.99,https://www.amazon.com//Anleo-Portable-12000mAh-External-Battery/dp/B06XV7W59N/ref=sr_1_32?dchild=1&keywords=POWERADD+power+bank&qid=1619354129&sr=8-32,"{'Package Dimensions': '15.35 x 4.76 x 1.73 inches', 'Item Weight': '3.52 ounces', 'ASIN': 'B06XV7W59N', 'Item model number': '4344257439', 'Customer Reviews': '4.6 out of 5 stars\n\n\n\n\n\n\n\n\n373 ratings\n\n\n\n\n\n\n4.6 out of 5 stars', 'Best Sellers Rank': '#21,813 in Cell Phones & Accessories (See Top 100 in Cell Phones & Accessories)\n\n#412 in Cell Phone Portable Power Banks\n\n#557 in Cell Phone Replacement Batteries', 'Is Discontinued By Manufacturer': 'No', 'Date First Available': 'March 25, 2017', 'Manufacturer': 'Anleo'}",4.6 out of 5 stars,373
Mobile,Power Bank RAVPower 16750mAh Portable Charger Ultra-Compact External Battery Pack with 4.5A Max Output Phone Charger 2 USB Ports & Flashlight for iPhone 12 Mini Pro Max 11 SE Samsung Galaxy S20 White,$26.99,https://www.amazon.com//Portable-Chargers-RAVPower-16750mAh-External/dp/B00MQSMDYU/ref=sr_1_36?dchild=1&keywords=POWERADD+power+bank&qid=1619354129&sr=8-36,"{'Product Dimensions': '5 x 3.19 x 0.79 inches', 'Item Weight': '10.9 ounces', 'ASIN': 'B00MQSMDYU', 'Item model number': 'RP-PB19', 'Batteries': '5 Lithium ion batteries required. (included)', 'Customer Reviews': '4.6 out of 5 stars\n\n\n\n\n\n\n\n\n2,888 ratings\n\n\n\n\n\n\n4.6 out of 5 stars', 'Best Sellers Rank': '#3,235 in Cell Phones & Accessories (See Top 100 in Cell Phones & Accessories)\n\n#92 in Cell Phone Portable Power Banks\n\n#94 in Cell Phone Replacement Batteries', 'Is Discontinued By Manufacturer': 'No', 'Date First Available': 'August 14, 2014', 'Manufacturer': 'RAVPower'}",4.6 out of 5 stars,2888
Mobile,"AUKUY Wireless Charger, PowerWave Pad Qi-Certified 10W Max for iPhone SE (2020), 11, 11 Pro, 11 Pro Max, Xs Max, XR, XS, X, 8, 8 Plus, AirPods, Galaxy S20 S10 S9 S8, Note 10 9 8 (No AC Adapter)",$7.99,https://www.amazon.com//gp/slredirect/picassoRedirect.html/ref=pa_sp_atf_next_aps_sr_pg3_1?ie=UTF8&adId=A0962731E1DXAIYLNCLC&url=%2FAUKUY-Wireless-Charger-PowerWave-Qi-Certified%2Fdp%2FB08J7Z5DB8%2Fref%3Dsr_1_33_sspa%3Fdchild%3D1%26keywords%3DPOWERADD%2Bpower%2Bbank%26qid%3D1619354189%26sr%3D8-33-spons%26psc%3D1&qualifier=1619354189&id=6770743850316758&widgetName=sp_atf_next,"{'Package Dimensions': '4.7 x 4.2 x 1.2 inches', 'Item Weight': '3.2 ounces', 'ASIN': 'B08J7Z5DB8', 'Customer Reviews': '3.7 out of 5 stars\n\n\n\n\n\n\n\n\n36 ratings\n\n\n\n\n\n\n3.7 out of 5 stars', 'Best Sellers Rank': '#86,909 in Cell Phones & Accessories (See Top 100 in Cell Phones & Accessories)\n\n#621 in Cell Phone Wireless Chargers', 'Other display features': 'Wireless', 'Manufacturer': 'AUKUY', 'Date First Available': 'September 16, 2020'}",3.7 out of 5 stars,36
Mobile,HALO Bolt 58830 mWh Portable Phone Laptop Charger Car Jump Starter with AC Outlet and Car Charger - Grey,$99.99,https://www.amazon.com//Halo-Portable-Laptop-Charger-Starter/dp/B079FSPRXM/ref=sr_1_35?dchild=1&keywords=POWERADD+power+bank&qid=1619354189&sr=8-35,"{'Compatible Devices': 'Smartphones, Tablets, Laptops', 'Brand': 'Halo', 'Color': 'Grey', 'Item Weight': '0.614 ounces', 'Input Voltage': '12 Volts', 'Total USB Ports': '2', 'Product Dimensions': '7.2 x 1.6 x 3.8 inches', 'ASIN': 'B079FSPRXM', 'Item model number': 'HALO Bolt ACDC 58830', 'Batteries': '1 Lithium Polymer batteries required. (included)', 'Customer Reviews': '4.6 out of 5 stars\n\n\n\n\n\n\n\n\n11,161 ratings\n\n\n\n\n\n\n4.6 out of 5 stars', 'Best Sellers Rank': '#840 in Cell Phones & Accessories (See Top 100 in Cell Phones & Accessories)\n\n#25 in Cell Phone Portable Power Banks\n\n#26 in Cell Phone Replacement Batteries', 'Is Discontinued By Manufacturer': 'No', 'Connectivity technologies': 'Usb', 'Other display features': 'Wireless', 'Colour': 'Grey', 'Included Components': 'AC Wall Charging Adapter, 14V USB car charger, Operating Instructions, USB to Micro USB Cable, Carrying pouch, HALO Bolt ACDC 58830, Jumper cables, Quick Start Guide', 'Manufacturer': 'HALO', 'Date First Available': 'January 5, 2018'}",4.6 out of 5 stars,11161
Mobile,"POWERADD USB C Power Strip with Power Delivery 18W, Travel Power Strip Mini & Portable +POWERADD Ultra-Compact Power Bank, EnergyCell 10000 Neo Portable Charger",32.99,https://www.amazon.com//POWERADD-Delivery-Portable-Ultra-Compact-EnergyCell/dp/B08MW59LS6/ref=sr_1_36?dchild=1&keywords=POWERADD+power+bank&qid=1619354189&sr=8-36,"{'Connector Type': 'USB Type C', 'Brand': 'POWERADD', 'Number of Ports': '3', 'ASIN': 'B08MW59LS6', 'Date First Available': 'November 24, 2020'}",,
Mobile,"HALO - Pocket Power 6000 Portable Charger Power Bank for Phone - High-Speed TSA Approved 6000mAh Battery Pack - Standard USB Output and Micro USB Cable, Lightning Cable, USB Type C Cable - Rose Gold",$39.99,https://www.amazon.com//gp/slredirect/picassoRedirect.html/ref=pa_sp_mtf_aps_sr_pg3_1?ie=UTF8&adId=A02023631XS8F1J4C0AQN&url=%2FHALO-Portable-High-Speed-Approved-Lightning%2Fdp%2FB083SCNKW4%2Fref%3Dsr_1_37_sspa%3Fdchild%3D1%26keywords%3DPOWERADD%2Bpower%2Bbank%26qid%3D1619354189%26sr%3D8-37-spons%26psc%3D1&qualifier=1619354189&id=6770743850316758&widgetName=sp_mtf,"{'Package Dimensions': '9.02 x 6.3 x 1.69 inches', 'Item Weight': '8.9 ounces', 'ASIN': 'B083SCNKW4', 'Item model number': '111594', 'Batteries': '1 Product Specific batteries required. (included)', 'Customer Reviews': '4.5 out of 5 stars\n\n\n\n\n\n\n\n\n214 ratings\n\n\n\n\n\n\n4.5 out of 5 stars', 'Best Sellers Rank': '#5,338 in Cell Phones & Accessories (See Top 100 in Cell Phones & Accessories)\n\n#142 in Cell Phone Portable Power Banks\n\n#146 in Cell Phone Replacement Batteries', 'Other display features': 'Wireless', 'Colour': 'Rose Gold', 'Included Components': 'USB Type C Cable, Operating Instructions, Micro USB Cable, HALO Pocket Power 6,000, Lightning Cable', 'Manufacturer': 'HALO', 'Date First Available': 'January 13, 2020'}",4.5 out of 5 stars,214
Mobile,Portable Charger Power Bank 20000mAh RAVPower USB External Battery Pack Dual iSmart USB Ports Ultra Compact Phone Charger Compatible with iPhone 12 11 Pro Max Galaxy S10 Note 10 iPad Pro Android,$29.99,https://www.amazon.com//Portable-RAVPower-20000mAh-External-Compatible/dp/B07VWG2L4D/ref=sr_1_39?dchild=1&keywords=POWERADD+power+bank&qid=1619354189&sr=8-39,"{'Color': 'Black', 'Brand': 'RAVPower', 'Connector Type': 'Usb, Micro usb', 'Battery Capacity': '20000 Milliamp Hours', 'Item Dimensions LxWxH': '6.69 x 3.15 x 0.79 inches', 'Item Weight': '15.7 ounces', 'Charging Time': '10 Hours', 'Number of Ports': '2', 'Product Dimensions': '6.69 x 3.15 x 0.79 inches', 'ASIN': 'B07VWG2L4D', 'Item model number': 'PB006', 'Customer Reviews': '4.6 out of 5 stars\n\n\n\n\n\n\n\n\n847 ratings\n\n\n\n\n\n\n4.6 out of 5 stars', 'Best Sellers Rank': '#19,545 in Cell Phones & Accessories (See Top 100 in Cell Phones & Accessories)\n\n#379 in Cell Phone Portable Power Banks\n\n#496 in Cell Phone Replacement Batteries', 'Other display features': 'Wireless', 'Colour': 'Black', 'Included Components': '1', 'Manufacturer': 'RAVPOWER', 'Date First Available': 'July 31, 2019'}",4.6 out of 5 stars,847
Mobile,Portable Charger 20000mAh Power Bank Quick Charge 3.0 USB-C PD 18w Fast Charging 2 Input 4 Output Power Delivery QC External Battery Pack Compatible with Android Samsung Galaxy Pixel iPhone More,$25.18,https://www.amazon.com//gp/slredirect/picassoRedirect.html/ref=pa_sp_btf_aps_sr_pg3_1?ie=UTF8&adId=A01945031OFQ318PTWM2W&url=%2FPortable-20000mAh-Charging-Delivery-Compatible%2Fdp%2FB084NYGX3S%2Fref%3Dsr_1_41_sspa%3Fdchild%3D1%26keywords%3DPOWERADD%2Bpower%2Bbank%26qid%3D1619354189%26sr%3D8-41-spons%26psc%3D1&qualifier=1619354189&id=6770743850316758&widgetName=sp_btf,"{'Color': 'Black', 'Brand': 'Gatcepot', 'Connector Type': 'Usb type c, Usb, Usb type a', 'Battery Capacity': '20000 Milliamp Hours', 'Item Dimensions LxWxH': '6.69 x 3.15 x 1.18 inches', 'Battery Cell Composition': 'Lithium Ion', 'Item Weight': '10.4 ounces', 'Number of Ports': '3', 'Product Dimensions': '6.69 x 3.15 x 1.18 inches', 'ASIN': 'B084NYGX3S', 'Item model number': 'P21', 'Batteries': '1 Lithium ion batteries required. (included)', 'Customer Reviews': '4.4 out of 5 stars\n\n\n\n\n\n\n\n\n26 ratings\n\n\n\n\n\n\n4.4 out of 5 stars', 'Best Sellers Rank': '#138,042 in Cell Phones & Accessories (See Top 100 in Cell Phones & Accessories)\n\n#1,376 in Cell Phone Portable Power Banks\n\n#3,125 in Cell Phone Replacement Batteries', 'Special Features': 'QC3.0&PD3.0 18W Quick Charge, 5V3A & 5V/2A Fast charging', 'Other display features': 'Wireless', 'Colour': 'Black', 'Manufacturer': 'Tecnicpro', 'Date First Available': 'January 1, 2020'}",4.4 out of 5 stars,26
Mobile,"imuto 10000mah 18W PD QC 3.0 Portable Charger Power Bank USB C with LCD Display External Battery Charger Fast Charge Compatible with iPhone 12 Pro Max 11, Samsung S10, Nintendo Switch, iPad Pro, etc",$23.99,https://www.amazon.com//gp/slredirect/picassoRedirect.html/ref=pa_sp_btf_aps_sr_pg3_1?ie=UTF8&adId=A0293331MZM8QSINLK58&url=%2Fimuto-Portable-10000mAh-External-Nintendo%2Fdp%2FB07KMRCM6Y%2Fref%3Dsr_1_42_sspa%3Fdchild%3D1%26keywords%3DPOWERADD%2Bpower%2Bbank%26qid%3D1619354189%26sr%3D8-42-spons%26psc%3D1&qualifier=1619354189&id=6770743850316758&widgetName=sp_btf,"{'Color': '10000mAh with USB C 18W PD2.0', 'Brand': 'Imuto', 'Connector Type': 'Usb type c', 'Battery Capacity': '20000 Milliamp Hours', 'Item Dimensions LxWxH': '5.16 x 3.07 x 0.87 inches', 'Battery Cell Composition': 'Lithium', 'Item Weight': '9.1 ounces', 'Charging Time': '4 Hours', 'Number of Ports': '3', 'Product Dimensions': '5.16 x 3.07 x 0.87 inches', 'ASIN': 'B07KMRCM6Y', 'Item model number': 'X2', 'Batteries': '4 Lithium ion batteries required. (included)', 'Customer Reviews': '4.4 out of 5 stars\n\n\n\n\n\n\n\n\n1,178 ratings\n\n\n\n\n\n\n4.4 out of 5 stars', 'Best Sellers Rank': '#21,707 in Cell Phones & Accessories (See Top 100 in Cell Phones & Accessories)\n\n#410 in Cell Phone Portable Power Banks\n\n#554 in Cell Phone Replacement Batteries', 'Is Discontinued By Manufacturer': 'No', 'Other display features': 'Wireless', 'Colour': '10000mAh with USB C 18W PD2.0', 'Included Components': 'X5PD Portable Battery Power Bank, Travel waterproof pouch, User guide, USB A to C cable', 'Manufacturer': 'imuto', 'Date First Available': 'December 3, 2017'}",4.4 out of 5 stars,1178
Mobile,"Portable Bluetooth Shower Speaker with HD Stereo/Rich Bass IPX7 Waterproof, Wireless Small Speaker with LED Light for Outdoor/Travel/Pool Beach/Bike, Support TF Card/TWS/AUX Mode, 12H Playtime, Black",$29.99,https://www.amazon.com//gp/slredirect/picassoRedirect.html/ref=pa_sp_atf_next_aps_sr_pg4_1?ie=UTF8&adId=A0242342I5C06U6OXQO1&url=%2FPOWERADD-MusicFly-Portable-Bluetooth-Waterproof%2Fdp%2FB079W5MMLF%2Fref%3Dsr_1_50_sspa%3Fdchild%3D1%26keywords%3DPOWERADD%2Bpower%2Bbank%26qid%3D1619354257%26sr%3D8-50-spons%26psc%3D1&qualifier=1619354257&id=174601358340326&widgetName=sp_atf_next,"{'Brand': 'POWERADD', 'Color': 'Black', 'Speaker Type': 'Portable Bluetooth Speaker', 'Battery Life': '12 Hours', 'Item Weight': '1 pounds', 'Mounting Type': 'Table Top', 'Speaker Maximum Output Power': '15 Watts', 'Controller Type': 'Battery Powered', 'Product Dimensions': '6.81 x 2.64 x 1.92 inches', 'ASIN': 'B079W5MMLF', 'Item model number': 'BT082', 'Batteries': '4 Lithium Polymer batteries required. (included)', 'Customer Reviews': '4.4 out of 5 stars\n\n\n\n\n\n\n\n\n1,406 ratings\n\n\n\n\n\n\n4.4 out of 5 stars', 'Best Sellers Rank': '#1,196 in Portable Bluetooth Speakers\n\n#10,932 in MP3 & MP4 Player Accessories', 'Is Discontinued By Manufacturer': 'No', 'Date First Available': 'April 9, 2018', 'Manufacturer': 'POWERADD'}",4.4 out of 5 stars,1406
Mobile,"HALO - Pocket Power 6000 Portable Charger Power Bank for Phone - High-Speed TSA Approved 6000mAh Battery Pack - Standard USB Output and Micro USB Cable, Lightning Cable, USB Type C Cable - Platinum",$39.11,https://www.amazon.com//gp/slredirect/picassoRedirect.html/ref=pa_sp_mtf_aps_sr_pg4_1?ie=UTF8&adId=A02018633Q15SJFXLCXGU&url=%2FHALO-Portable-High-Speed-Approved-Lightning%2Fdp%2FB083SCM8XC%2Fref%3Dsr_1_51_sspa%3Fdchild%3D1%26keywords%3DPOWERADD%2Bpower%2Bbank%26qid%3D1619354257%26sr%3D8-51-spons%26psc%3D1&qualifier=1619354257&id=174601358340326&widgetName=sp_mtf,"{'Package Dimensions': '9.06 x 6.1 x 1.85 inches', 'Item Weight': '8.8 ounces', 'ASIN': 'B083SCM8XC', 'Item model number': '111558', 'Batteries': '1 Product Specific batteries required. (included)', 'Customer Reviews': '4.7 out of 5 stars\n\n\n\n\n\n\n\n\n49 ratings\n\n\n\n\n\n\n4.7 out of 5 stars', 'Best Sellers Rank': '#5,338 in Cell Phones & Accessories (See Top 100 in Cell Phones & Accessories)\n\n#142 in Cell Phone Portable Power Banks\n\n#146 in Cell Phone Replacement Batteries', 'Other display features': 'Wireless', 'Colour': 'Platinum', 'Included Components': 'USB Type C Cable, Operating Instructions, Micro USB Cable, HALO Pocket Power 6,000, Lightning Cable', 'Manufacturer': 'HALO', 'Date First Available': 'January 13, 2020'}",4.7 out of 5 stars,49
Mobile,"USB C Charger, AUKEY Omnia 90W 3-Port MacBook Pro Charger with GaNFast Technology, PD Charger USB C Fast Charger USB C Laptop Charger for MacBook Pro 16"", iPhone 11 Pro Max, Galaxy S20+/Note 20 Ultra",$49.99,https://www.amazon.com//gp/slredirect/picassoRedirect.html/ref=pa_sp_atf_next_aps_sr_pg5_1?ie=UTF8&adId=A04628883AXVPDB604BAL&url=%2FCharger-AUKEY-MacBook-GaNFast-Technology%2Fdp%2FB08FR2GRLY%2Fref%3Dsr_1_65_sspa%3Fdchild%3D1%26keywords%3DPOWERADD%2Bpower%2Bbank%26qid%3D1619354288%26sr%3D8-65-spons%26psc%3D1%26smid%3DA1C42Z726BRSME&qualifier=1619354288&id=6069581873492199&widgetName=sp_atf_next,"{'Compatible Devices': 'Laptops', 'Brand': 'AUKEY', 'Color': 'White', 'Item Weight': '6.7 ounces', 'Input Voltage': '240 Volts', 'Total USB Ports': '3', 'Product Dimensions': '2.52 x 2.44 x 1.3 inches', 'ASIN': 'B08FR2GRLY', 'Item model number': 'PA-B6S', 'Customer Reviews': '4.6 out of 5 stars\n\n\n\n\n\n\n\n\n2,026 ratings\n\n\n\n\n\n\n4.6 out of 5 stars', 'Best Sellers Rank': '#2,808 in Cell Phones & Accessories (See Top 100 in Cell Phones & Accessories)\n\n#177 in Cell Phone Wall Chargers', 'Is Discontinued By Manufacturer': 'Yes', 'Other display features': 'Wireless', 'Colour': 'White', 'Manufacturer': 'AUKEY', 'Date First Available': 'August 12, 2020'}",4.6 out of 5 stars,2026
